{"$schema":"https://json-schema.org/draft/2020-12/schema","intents":[{"freshness":[{"assertion_ids":["assertion-owner-approval-submitted-pending"],"freshness_id":"freshness-owner-approval-owner-list","mode":"read_after_write","observation_stage_id":"stage-owner-approval-fresh-read","write_stage_id":"stage-owner-approval-submit"},{"assertion_ids":["assertion-owner-approval-rejected"],"freshness_id":"freshness-owner-approval-approval-list","mode":"read_after_write","observation_stage_id":"stage-owner-approval-fresh-read","write_stage_id":"stage-owner-approval-approve"}],"implementations":[{"backend":"legacy_symfony","claim":"supported","reason_code":null,"witnesses":[{"edges":[{"edge_id":"owner-approval-legacy_symfony-accepted-order-01","from":"owner-approval-legacy_symfony-submit","kind":"order","relation":"must_precede","to":"owner-approval-legacy_symfony-owner-read"},{"edge_id":"owner-approval-legacy_symfony-accepted-order-02","from":"owner-approval-legacy_symfony-owner-read","kind":"order","relation":"must_precede","to":"owner-approval-legacy_symfony-approval-queue-read"},{"edge_id":"owner-approval-legacy_symfony-accepted-order-03","from":"owner-approval-legacy_symfony-approval-queue-read","kind":"order","relation":"must_precede","to":"owner-approval-legacy_symfony-approve"},{"edge_id":"owner-approval-legacy_symfony-accepted-order-04","from":"owner-approval-legacy_symfony-approve","kind":"order","relation":"must_precede","to":"owner-approval-legacy_symfony-fresh-owner-list"},{"edge_id":"owner-approval-legacy_symfony-accepted-order-05","from":"owner-approval-legacy_symfony-fresh-owner-list","kind":"order","relation":"must_precede","to":"owner-approval-legacy_symfony-fresh-approval-list"},{"edge_id":"owner-approval-legacy_symfony-accepted-order-06","from":"owner-approval-legacy_symfony-fresh-approval-list","kind":"order","relation":"must_precede","to":"owner-approval-legacy_symfony-accepted-outbox-observation"},{"edge_id":"owner-approval-legacy_symfony-accepted-order-07","from":"owner-approval-legacy_symfony-accepted-outbox-observation","kind":"order","relation":"must_precede","to":"owner-approval-legacy_symfony-accepted-boundary-observation"},{"edge_id":"owner-approval-legacy_symfony-accepted-freshness-owner-approval-owner-list-read-after-write","from":"owner-approval-legacy_symfony-submit","kind":"order","relation":"read_after_write","to":"owner-approval-legacy_symfony-fresh-owner-list"},{"edge_id":"owner-approval-legacy_symfony-accepted-freshness-owner-approval-approval-list-read-after-write","from":"owner-approval-legacy_symfony-approve","kind":"order","relation":"read_after_write","to":"owner-approval-legacy_symfony-fresh-approval-list"}],"evidence_receipt_ref_ids":["receipt-68407e5a7699e6fc32cac7aedc3d4e3243b0c03fe431052eade1b3f7877ed1fa"],"nodes":[{"expected_operation_sha256":"sha256:cd2065ad83d861e18459075b7754e2a294151c882e1e7a5e4fa0391f3dd84919","kind":"operation","node_id":"owner-approval-legacy_symfony-submit","operation_ref_id":"operation://legacy_symfony/api_receipts_post","predicate_refs":["predicate://claim-evidence/owner-approval/owner-session"],"realizes_stage_ids":["stage-owner-approval-submit"]},{"expected_operation_sha256":"sha256:6e5db53066b27c4cb2fdd1492873873edbc8cc69516306856700bdc9fa50b41d","kind":"operation","node_id":"owner-approval-legacy_symfony-owner-read","operation_ref_id":"operation://legacy_symfony/api_myreceipts_get_collection","predicate_refs":["predicate://claim-evidence/owner-approval/owner-session"],"realizes_stage_ids":["stage-owner-approval-owner-read"]},{"expected_operation_sha256":"sha256:95de2ac6144c27c371994346b832ee319c45b84d76c46a0b639c662e7df88801","kind":"operation","node_id":"owner-approval-legacy_symfony-approval-queue-read","operation_ref_id":"operation://legacy_symfony/api_adminreceipts_get_collection","predicate_refs":["predicate://claim-evidence/owner-approval/approver-scope"],"realizes_stage_ids":["stage-owner-approval-queue-read"]},{"expected_operation_sha256":"sha256:0cf80f7080a62b6d4dd73819f37776a3abfe0a3840075424b08d3c84ca9c3d7c","kind":"operation","node_id":"owner-approval-legacy_symfony-approve","operation_ref_id":"operation://legacy_symfony/api_adminreceipts_idstatus_put","predicate_refs":["predicate://claim-evidence/owner-approval/approver-scope"],"realizes_stage_ids":["stage-owner-approval-approve"]},{"expected_operation_sha256":"sha256:6e5db53066b27c4cb2fdd1492873873edbc8cc69516306856700bdc9fa50b41d","kind":"operation","node_id":"owner-approval-legacy_symfony-fresh-owner-list","operation_ref_id":"operation://legacy_symfony/api_myreceipts_get_collection","predicate_refs":["predicate://claim-evidence/owner-approval/owner-session"],"realizes_stage_ids":["stage-owner-approval-fresh-read"]},{"expected_operation_sha256":"sha256:95de2ac6144c27c371994346b832ee319c45b84d76c46a0b639c662e7df88801","kind":"operation","node_id":"owner-approval-legacy_symfony-fresh-approval-list","operation_ref_id":"operation://legacy_symfony/api_adminreceipts_get_collection","predicate_refs":["predicate://claim-evidence/owner-approval/approver-scope"],"realizes_stage_ids":["stage-owner-approval-fresh-read"]},{"assertion_ids":[],"kind":"local_observation","node_id":"owner-approval-legacy_symfony-accepted-outbox-observation","observation_kind":"outbox"},{"assertion_ids":["assertion-owner-approval-submitted-pending","assertion-owner-approval-owner-scoped-list","assertion-owner-approval-queue-scoped","assertion-owner-approval-rejected"],"kind":"local_observation","node_id":"owner-approval-legacy_symfony-accepted-boundary-observation","observation_kind":"browser"}],"purpose":"accepted","satisfies":{"assertion_ids":["assertion-owner-approval-submitted-pending","assertion-owner-approval-owner-scoped-list","assertion-owner-approval-queue-scoped","assertion-owner-approval-rejected"],"effect_ids":[],"freshness_ids":["freshness-owner-approval-owner-list","freshness-owner-approval-approval-list"],"precondition_ids":[],"rejection_ids":[]},"witness_id":"owner-approval-legacy_symfony-accepted"},{"edges":[{"edge_id":"owner-approval-legacy_symfony-authorization-authority-01","from":"owner-approval-legacy_symfony-owner-session-boundary","kind":"authority","precondition_id":"precondition-owner-approval-owner-session","to":"owner-approval-legacy_symfony-authorization-boundary-observation"},{"edge_id":"owner-approval-legacy_symfony-authorization-authority-02","from":"owner-approval-legacy_symfony-approver-scope-boundary","kind":"authority","precondition_id":"precondition-owner-approval-approver-scope","to":"owner-approval-legacy_symfony-authorization-boundary-observation"}],"evidence_receipt_ref_ids":["receipt-68407e5a7699e6fc32cac7aedc3d4e3243b0c03fe431052eade1b3f7877ed1fa"],"nodes":[{"expected_operation_sha256":"sha256:6e5db53066b27c4cb2fdd1492873873edbc8cc69516306856700bdc9fa50b41d","kind":"operation","node_id":"owner-approval-legacy_symfony-owner-session-boundary","operation_ref_id":"operation://legacy_symfony/api_myreceipts_get_collection","predicate_refs":["predicate://claim-evidence/owner-approval/owner-session"],"realizes_stage_ids":["stage-owner-approval-owner-read"]},{"expected_operation_sha256":"sha256:95de2ac6144c27c371994346b832ee319c45b84d76c46a0b639c662e7df88801","kind":"operation","node_id":"owner-approval-legacy_symfony-approver-scope-boundary","operation_ref_id":"operation://legacy_symfony/api_adminreceipts_get_collection","predicate_refs":["predicate://claim-evidence/owner-approval/approver-scope"],"realizes_stage_ids":["stage-owner-approval-queue-read"]},{"assertion_ids":[],"kind":"local_observation","node_id":"owner-approval-legacy_symfony-authorization-boundary-observation","observation_kind":"browser"}],"purpose":"rejection","satisfies":{"assertion_ids":[],"effect_ids":[],"freshness_ids":[],"precondition_ids":["precondition-owner-approval-owner-session","precondition-owner-approval-approver-scope"],"rejection_ids":[]},"witness_id":"owner-approval-legacy_symfony-authorization"},{"edges":[{"edge_id":"owner-approval-legacy_symfony-rejection-order-01","from":"owner-approval-legacy_symfony-not-pending-approval","kind":"order","relation":"must_precede","to":"owner-approval-legacy_symfony-rejection-owner-readback"},{"edge_id":"owner-approval-legacy_symfony-rejection-order-02","from":"owner-approval-legacy_symfony-rejection-owner-readback","kind":"order","relation":"must_precede","to":"owner-approval-legacy_symfony-rejection-state-readback-observation"}],"evidence_receipt_ref_ids":["receipt-68407e5a7699e6fc32cac7aedc3d4e3243b0c03fe431052eade1b3f7877ed1fa"],"nodes":[{"expected_operation_sha256":"sha256:0cf80f7080a62b6d4dd73819f37776a3abfe0a3840075424b08d3c84ca9c3d7c","kind":"operation","node_id":"owner-approval-legacy_symfony-not-pending-approval","operation_ref_id":"operation://legacy_symfony/api_adminreceipts_idstatus_put","predicate_refs":["predicate://claim-evidence/owner-approval/not-pending"],"realizes_stage_ids":["stage-owner-approval-approve"]},{"expected_operation_sha256":"sha256:6e5db53066b27c4cb2fdd1492873873edbc8cc69516306856700bdc9fa50b41d","kind":"operation","node_id":"owner-approval-legacy_symfony-rejection-owner-readback","operation_ref_id":"operation://legacy_symfony/api_myreceipts_get_collection","predicate_refs":["predicate://claim-evidence/owner-approval/owner-session"],"realizes_stage_ids":["stage-owner-approval-fresh-read"]},{"assertion_ids":[],"kind":"local_observation","node_id":"owner-approval-legacy_symfony-rejection-state-readback-observation","observation_kind":"persistence"}],"purpose":"rejection","satisfies":{"assertion_ids":[],"effect_ids":[],"freshness_ids":[],"precondition_ids":[],"rejection_ids":["rejection-owner-approval-not-pending"]},"witness_id":"owner-approval-legacy_symfony-rejection"}]},{"backend":"native_effect","claim":"supported","reason_code":null,"witnesses":[{"edges":[{"edge_id":"owner-approval-native_effect-accepted-order-01","from":"owner-approval-native_effect-submit","kind":"order","relation":"must_precede","to":"owner-approval-n